[
  {
    "arquivo_json": "2024-08-15-09-33-44-conlicitacao-0a71f31139187dbb40b32437ad3794f0.json",
    "numero_pregao": "PE/90034/2024",
    "orgao": "MINISTÉRIO DA DEFESA - Comando da Marinha - Comando de Operações Navais - Comando do 2º Distrito Naval - Base Naval de Aratu",
    "cidade": "Salvador",
    "estado": "BA",
    "anexos_processados": [
      "02_-_termo_de_referncia-5a8119.pdf",
      "relacaoitens78280105900342024000-19a297.pdf"
    ],
    "itens_extraidos": [
      {
        "lote": null,
        "item": 1,
        "objeto": "Contratação de empresa especializada em Tecnologia da Informação para fornecer serviços que atendas as necessidades da área industrial da Base Naval de Aratu",
        "quantidade": 3,
        "unidade_fornecimento": "MENSAL"
      }
    ]
  },
  {
    "arquivo_json": "2024-08-15-09-33-44-conlicitacao-164dd14eb625bb75bf0566e11d2ceca8.json",
    "numero_pregao": "PE/90101/2024",
    "orgao": "Prefeitura Municipal de Realeza",
    "cidade": "Realeza",
    "estado": "PR",
    "anexos_processados": [
      "edital_pe_101-c0a63e.pdf",
      "relacaoitens98780505901012024000-133f92.pdf"
    ],
    "itens_extraidos": [
      {
        "lote": "Lote 1",
        "item": 1,
        "objeto": "AMPLIFICADOR PARA BAIXO- LINHA: IMPACT BASS, ALTO- FALANTE DE 12 POLEGADAS, TWEETER FENÓLICO PARA REALÇAR AS FREQUÊNCIAS ALTAS, 150W RMS, ENTRADA PARA BAIXO ATIVO OU PASSIVO INDEPENDENTES, CONTROLE DE GRAVE, MÉDIO E AGUDO, AJUSTES DE GANHO E MASTER INDEPENDENTES, SAÍDA DE LINHA, SAÍDA DIRECT OUT BALANCEADA, SAÍDA PARA CAIXA PASSIVA, PROTEÇÃO TÉRMICA DO CIRCUITO DE AMPLIFICAÇÃO, GABINETE RECLINÁVEL PARA USO COMO MONITOR DE PALCO, ALÇAS LATERAIS, GRADE DE PROTEÇÃO DE AÇO PERFURADA PARA PROTEGER O ALTOFALANTE E TWEETER, ACABAMENTO EM COURO ECOLÓGICO PRETO, CHAVE COMUTADORA DE TENSÃO 110V OU 220V AC (APRESENTAR AMOSTRA)",
        "quantidade": 1,
        "unidade_fornecimento": "UNID"
      },
      {
        "lote": "Lote 1",
        "item": 2,
        "objeto": "BATERIA ACÚSTICA ONIX SKINNY 20- BATERIA COMPOSTA DE DOIS TONS, BOBO, SURDO, CAIXA, BANCO, AROS E FERRAGENS EM METAL (APRESENTAR AMOSTRA)",
        "quantidade": 1,
        "unidade_fornecimento": "UNID"
      },
      {
        "lote": "Lote 1",
        "item": 3,
        "objeto": "BOMBARDIDO- 3 PISTOS EM SI BEMOL (APRESENTAR AMOSTRA)",
        "quantidade": 1,
        "unidade_fornecimento": "UNID"
      },
      {
        "lote": "Lote 1",
        "item": 4,
        "objeto": "BRAÇO DATASHOW- LARGURA DA BANDEJA: 28 ATÉ 40CM - PROFUNDIDADE DA BANDEJA: 26CM - LOCAL DE INSTALAÇÃO: TETO - DISTÂNCIA MÍNIMA DO TETO: 50 CM - DISTÂNCIA MÁXIMA DO TETO: 75 CM - CARGA MÁXIMA: 15 KG - COR: BRANCA OU PRETO - MATERIAL DO SUPORTE: AÇO CARBONO COM PINTURA ELETROSTÁTICA A PÓ. - GIRO DO PROJETOR: 360o - PONTOS DE FIXAÇÃO: 3 PONTOS NO TETO - DIMENSÕES DA EMBALAGEM - FABRICAÇÃO: NACIONAL",
        "quantidade": 8,
        "unidade_fornecimento": "UNID"
      },
      {
        "lote": "Lote 1",
        "item": 5,
        "objeto": "CABO HDMI 100M METROS- CABO HDMI 100M METROS FULLH - 8K ALTA RESOLUÇÃO CABO NA COR PRETA.",
        "quantidade": 6,
        "unidade_fornecimento": "UNID"
      },
      {
        "lote": "Lote 1",
        "item": 6,
        "objeto": "CABO HDMI 20M METROS- CABO HDMI 20M METROS ULTRA HD 3D - 4K ALTA RESOLUÇÃO – CABO NA COR PRETA",
        "quantidade": 10,
        "unidade_fornecimento": "UNID"
      },
      {
        "lote": "Lote 1",
        "item": 7,
        "objeto": "CABO MICROFONE 2X0,30 BALANCEADO ESTÉREO BLINDADO- CABO PARA MICROFONE BALANCEADO 2X0,30 MM - ROLO COM 100 METROS - CONDUTOR 2X0,30 MM2 - ESTÉREO - ISOLAMENTO POLIETILENO - BLINDAGEM FITA DE ALUMÍNIO + BLINDAGEM EM COBRE TRANÇADO (64% DE MALHA DE COBERTURA DE COBRE ESTANHADO) - COBERTURA PVC FLEXÍVEL - IMPEDÂNCIA 56 OHMS",
        "quantidade": 12,
        "unidade_fornecimento": "UNID"
      },
      {
        "lote": "Lote 1",
        "item": 8,
        "objeto": "CABO P/ MICROFONE E DMX 10 METROS- CABO BALANCEADO, PONTAS DE CONEXÃO CANNON XLR MACHO E FÊMEA, DIÂMETRO 6MM BLINDADO, TAMANHO – 10 METROS, COR DO CABO – PRETO",
        "quantidade": 5,
        "unidade_fornecimento": "UNID"
      },
      {
        "lote": "Lote 1",
        "item": 9,
        "objeto": "CABO P/ MICROFONE E DMX 5 METROS- CABO BALANCEADO, PONTAS DE CONEXÃO CANNON XLR MACHO E FÊMEA, DIÂMETRO 6MM BLINDADO, TAMANHO – 5 METROS, COR DO CABO – PRETO",
        "quantidade": 4,
        "unidade_fornecimento": "UNID"
      },
      {
        "lote": "Lote 1",
        "item": 10,
        "objeto": "CABO P10 X P10 GUITARRA, VIOLÃO, ETC 5 METROS- TIPO DE CABO E ADAPTADOR P10 / P10 MONO – REVESTIDO EXTERNO COM CAPA DE NYLON - DIÂMETRO DO CABO 30 MM - TAMANHO AWG 22 – CONECTOR P10 MACHO NAS PONTAS – 5 METROS",
        "quantidade": 11,
        "unidade_fornecimento": "UNID"
      },
      {
        "lote": "Lote 1",
        "item": 11,
        "objeto": "CABOS MICROFONE/DMX - XLR/CANON BALANCEADO 5 METROS- BLINDAGEM: FITA DE ALUMÍNIO, BLINDAGEM 2: COBRE TRANÇADO, MATERIAL: PVC, BITOLA MM2: 0,20MM,2 BITOLA AWG: 24 AWG, TIPO DE PLUG (R): XLR FÊMEA MATERIAL DO PLUG (R): ZAMAC, XLR MACHO MATERIAL DO PLUG (R): ZAMAC. 5 METROS",
        "quantidade": 13,
        "unidade_fornecimento": "UNID"
      },
      {
        "lote": "Lote 1",
        "item": 12,
        "objeto": "CAIXA ATIVA 10 POLEGADAS- APLICAÇÃO: PARA USO EM PALESTRAS, CONVENÇÕES E SISTEMA DE SONORIZAÇÃO DE PEQUENO PORTE; - SISTEMA: CAIXA TRAPEZOIDAL DE 2 VIAS AMPLIFICADAS; - AMPLIFICADOR: 120 W/RMS (4 OHMS) E 80 W/RMS (8 OHMS) COM DCO, PROTEÇÃO DC E AUTO RAMPA; - RESPOSTA DE FREQUÊNCIA: 60 HZ A 18 KHZ; - ENTRADAS: 2 CANAIS INDEPENDENTES COM FILTRO SUBSONIC EM 40 HZ (12DB/OITAVA); ALIMENTAÇÃO: AUTOMÁTICA 120/230 V (50/60 HZ) COM ACIONAMENTO SOFT START; - FALANTES: 1X 10\", 1 DRIVE DE FAIXA ESTENDIDA. (APRESENTAR AMOSTRA)",
        "quantidade": 8,
        "unidade_fornecimento": "UNID"
      },
      {
        "lote": "Lote 1",
        "item": 13,
        "objeto": "CAIXA ATIVA BI-AMPLIFICADA 15\" 2-VIAS 300WRMS 100V/240V- ALTO-FALANTE DE 15\", DRIVER DE TITÂNIO 1 1/4\", BI-AMPLIFICADA, 300 W RMS, ENTRADAS BALANCEADAS XLR E TRS 1/4\", ENTRADAS P2 E RCA, AUTO VOLTAGE (100~240VAC), ANGULAÇÃO PARA USO COMO MONITOR (L/R), 03 PONTOS PARA MONTAGEM \"FLY\", ENCAIXE PARA PEDESTAL COM TRAVA, PESO: 19KG. COMUNICAÇÃO BLUETOOTH, CONTROLE REMOTO FRONTAL, 05 PRESETS DE EQUALIZAÇÃO (APRESENTAR AMOSTRA)",
        "quantidade": 3,
        "unidade_fornecimento": "UNID"
      },
      {
        "lote": "Lote 1",
        "item": 14,
        "objeto": "CAIXA DE SOM PROFISSIONAL 12' ATIVA- POTÊNCIA DE 1000 W - AMPLIFICADOR CLASSE D - MÁXIMO SPL: 126 DB - COBERTURA (NOMINAL -6 DB ): H 90° - COBERTURA (NOMINAL -6 DB ): V 60° - LF TRANSDUTOR: WOOFER DE 12' EVS-12K (30 CM) - HF TRANSDUTOR: DRIVER DE TITÂNIO DE 1,5' DH-1K - TIPO DE CONECTOR: 2 X XLR/P10 TRS COMBO JACK, 1 X P2 ENTRADA AUXILIAR (3,5 MM) E 1 X XLR LIGAÇÃO DE SAÍDA – BLUETOOTH - FAIXA DE FREQUÊNCIA: 50 HZ - 20 KHZ - DIMENSÕES: (LXAXP): 35,6 CM X 61 CM X 35,6 CM- PESO: 19KG (APRESENTAR AMOSTRA)",
        "quantidade": 9,
        "unidade_fornecimento": "UNID"
      },
      {
        "lote": "Lote 1",
        "item": 15,
        "objeto": "CANHAO REFLETOR LED RGBW- POTÊNCIA TOTAL DE 162 WATTS - LEDS DE 3 WATTS CADA - 12 LEDS VERMELHOS - 15 LEDS VERDES - 15 LEDS AZUIS - 12 LEDS BRANCOS - FUNCIONA NO AUTOMÁTICO - FUNCIONA PELA BATIDA DA MÚSICA - FUNCIONA PELO DMX COM 7 CANAIS - FUNÇÃO STROBO - DISPLAY DIGITAL - CARCAÇA EM PLÁSTICO - COM COOLER DE REFRIGERAÇÃO - FUNÇÃO MASTER / SLAVE - FUNCIONA COM E SEM MESA DMX - ALIMENTAÇÃO 110V/220V AUTOMÁTICA",
        "quantidade": 21,
        "unidade_fornecimento": "UNID"
      },
      {
        "lote": "Lote 1",
        "item": 16,
        "objeto": "CARREGADOR DE PILHAS AA- CARREGADOR DE PILHAS MODELO AA, CARREGA ATÉ 4 PILHAS AA OU AAA SIMULTANEAMENTE, E É COMPATÍVEL COM QUALQUER PILHA RECARREGÁVEL AA OU AAA. ACOMPANHA UM INDICADOR DE LED QUE INDICA A CARGA DAS PILHAS QUE SÃO CARREGADAS TOTALMENTE",
        "quantidade": 23,
        "unidade_fornecimento": "UNID"
      },
      {
        "lote": "Lote 1",
        "item": 17,
        "objeto": "CARREGADOR PARA NOTEBOOK- VOLTAGEM DE ENTRADA: 110 - 220V (BIVOLT AUTOMÁTICO). VOLTAGEM DE SAÍDA: 20V. AMPERAGEM MÁXIMA: 3,25a. POTENCIA TOTAL",
        "quantidade": 13,
        "unidade_fornecimento": "UNID"
      },
      {
        "lote": "Lote 1",
        "item": 18,
        "objeto": "CLARINETE EM SI BEMOL (APRESENTAR AMOSTRA)",
        "quantidade": 2,
        "unidade_fornecimento": "UNID"
      },
      {
        "lote": "Lote 1",
        "item": 19,
        "objeto": "CONECTORES PLUG CANON P10, MACHO- CONECTOR LINHA P10 MONO - PLUG P10 REFORÇADO PARA UTILIZAÇÃO PROFISSIONAL. - ACABAMENTO: NIQUELADO E BRILHANTE. - PERMITE SOLDAGEM PERFEITA.",
        "quantidade": 12,
        "unidade_fornecimento": "UNID"
      },
      {
        "lote": "Lote 1",
        "item": 20,
        "objeto": "CONECTORES PLUG CANON XLR, FÊMEA- CONECTOR LINHA XLR FÊMEA 3 POLOS - CONECTORES PLUG CANON XLR, FÊMEA- CONECTOR LINHA XLR FÊMEA 3 POLOS - PLUG XLR REFORÇADO PARA UTILIZAÇÃO PROFISSIONAL. - ACABAMENTO: NIQUELADO E BRILHANTE. - PERMITE SOLDAGEM PERFEITA",
        "quantidade": 12,
        "unidade_fornecimento": "UNID"
      },
      {
        "lote": "Lote 1",
        "item": 21,
        "objeto": "CONECTORES PLUG CANON XLR, MACHO- CONECTOR LINHA XLR MACHO 3 POLOS - PLUG XLR REFORÇADO PARA UTILIZAÇÃO PROFISSIONAL. - ACABAMENTO: NIQUELADO E BRILHANTE. - PERMITE SOLDAGEM PERFEITA",
        "quantidade": 12,
        "unidade_fornecimento": "UNID"
      },
      {
        "lote": "Lote 1",
        "item": 22,
        "objeto": "CORDAS CONTRA BAIXO 4 CORDAS 040-095 NÍQUEL- JOGO DE CORDAS DE COM REVESTIMENTO DE NÍQUEL PARA CONTRABAIXO ELÉTRICO DE 4 CORDAS. COR NORMAL NÍQUEL (PRATEADO), AS CORDAS NÃO SÃO COLORIDAS",